node_id,eta,gamma,depth,alpha,layer,document_count,top_k,top_words,word_count,node_npmi,node_c_v,node_u_mass,iteration
19121,0.1,0.05,3,0.1,2,1,10,"time, integrator, explicit, scale, contact, nonsmooth, impact, bridge, loading, fine",10,0.09138238458126172,0.7548895924994159,-2.7172689930875427,90
19122,0.1,0.05,3,0.1,2,1,10,"distribution, estimate, inverse, characterization, property, response, material, optimization, spatial, system",10,0.06828422589853884,0.611399839993186,-1.9280563689776786,90
19123,0.1,0.05,3,0.1,2,2,10,"nonlinear, line, cg, integral, fftbased, fast, transform, create, computational, gradient",10,-0.11570839172817614,0.3134636931553216,-4.011399024101388,90
19124,0.1,0.05,3,0.1,2,2,10,"film, strain, layer, sense, thin, property, employ, region, type, physical",10,-0.0003369765784933097,0.18094004962502494,-3.111025502878544,90
19125,0.1,0.05,3,0.1,2,1,10,"shell, open, dual, soil, poroelastic, agreement, wind, turbine, effectiveness, pair",10,-0.199317411465409,0.5071243320386174,-2.6267837316579956,90
19126,0.1,0.05,3,0.1,2,1,10,"free, surface, flow, level, fluid, phase, et, al, interface, water",10,-0.0225718459295488,0.59461782182863,-2.653401216877341,90
19127,0.1,0.05,3,0.1,2,1,10,"form, nodal, optimization, position, fe, inverse, iteration, elastoplastic, objective, configuration",10,-0.04263020177651471,0.657284943392432,-2.7860735184085774,90
19128,0.1,0.05,3,0.1,2,2,10,"strategy, contact, hierarchical, hybrid, full, modal, structural, major, severe, information",10,-0.1615049155136952,0.3348196524346756,-2.9004018435380865,90
19129,0.1,0.05,3,0.1,2,2,10,"level, set, interface, phase, regularization, energy, evolution, transformation, capture, shock",10,0.04128545113682039,0.46057338905363815,-2.679725839445339,90
19130,0.1,0.05,3,0.1,2,2,10,"fe, displacement, signal, excitation, surface, force, complex, field, rough, area",10,-0.10302752585016453,0.3253338757720978,-2.5205149609797965,90
19131,0.1,0.05,3,0.1,2,2,10,"force, manifold, smooth, motion, conclude, estimation, configuration, learn, whereby, tailor",10,-0.2581599384085397,0.2561549473688103,-7.696359915996799,90
19132,0.1,0.05,3,0.1,2,2,10,"discretization, time, balance, computation, zss, discrete, continuum, arterial, initial, guess",10,-0.08703603671893138,0.22029443911176777,-8.227245457902923,90
19133,0.1,0.05,3,0.1,2,1,10,"impact, friction, consistent, dissipation, theory, purely, inelastic, problem, year, publish",10,0.09987528552960952,0.5365364635692919,-2.603749408750645,90
19134,0.1,0.05,3,0.1,2,1,10,"simulation, cardiac, effort, accurate, conduction, shape, size, coarse, thus, constitute",10,-0.11917358536787238,0.4407200890295376,-2.7420714081658137,90
19135,0.1,0.05,3,0.1,2,1,10,"imperfection, random, field, geometrical, stability, stochastic, correlation, length, developed, optimize",10,-0.14058119499510124,0.7441566460576929,-2.683105698792045,90
19136,0.1,0.05,3,0.1,2,1,10,"stress, recover, elastic, system, multibody, computation, mode, set, choose, dynamical",10,0.057583175149980105,0.5618186685423197,-2.8909230294153816,90
19137,0.1,0.05,3,0.1,2,2,10,"magnetic, blood, flow, particle, drug, external, transport, couple, chain, multiphysics",10,0.17690092756468898,0.7891463611642805,-2.1552961461023754,90
19138,0.1,0.05,3,0.1,2,2,10,"subdomain, strategy, memory, macroscopic, overlap, along, parallel, subdomains, could, edge",10,-0.20436422168025412,0.192770357576397,-5.219667076212843,90
19139,0.1,0.05,3,0.1,2,1,10,"wavelet, excellent, function, stability, interpolation, formula, node, create, inversion, contain",10,-0.07758083572908996,0.23057979874051196,-2.654036562424556,90
19140,0.1,0.05,3,0.1,2,1,10,"flow, field, shape, network, predict, velocity, pressure, condition, show, neural",10,0.02329640862604708,0.3202325322937114,-2.2537927543440883,90
19141,0.1,0.05,3,0.1,2,3,10,"crack, split, drive, strain, stress, density, directional, modify, proper, definition",10,-0.01967308915993479,0.27397186667350926,-2.8675871997764855,90
19142,0.1,0.05,3,0.1,2,1,10,"mechanism, flexible, actuator, motion, treatment, lagrangian, applied, industrial, total, shell",10,-0.03328939339676226,0.45555663106880573,-2.5392162027713714,90
19143,0.1,0.05,3,0.1,2,2,10,"structure, base, failure, work, inverse, impact, load, condition, final, plastic",10,0.06261689089233174,0.5231903706113851,-2.593742236305084,90
19144,0.1,0.05,3,0.1,2,3,10,"mesh, deep, network, configuration, density, distribution, move, posterior, bayesian, optimization",10,-0.11432205172597452,0.1922801434314505,-6.110533536555953,90
19145,0.1,0.05,3,0.1,2,1,10,"behaviour, fe, fine, assembly, identification, joint, friction, tangential, generally, commonly",10,-0.17359132387660886,0.5502741271151648,-2.8088195437026,90
19146,0.1,0.05,3,0.1,2,1,10,"material, patch, hyperelastic, isogeometric, nurbs, nonconforming, nitsches, widely, rubber, biological",10,-0.11987847102171914,0.4152914118988426,-3.0730283407654277,90
19147,0.1,0.05,3,0.1,2,2,10,"homogenization, macroscopic, transient, steadystate, extract, phase, fluctuation, separation, microscopic, global",10,-0.0536258308494907,0.38983350308172426,-5.059831512039127,90
19148,0.1,0.05,3,0.1,2,1,10,"ductile, parameter, bayesian, inversion, failure, initiation, posterior, calibration, number, stage",10,-0.046485800208293585,0.7406320270556298,-2.497923850501315,90
19149,0.1,0.05,3,0.1,2,2,10,"low, topology, parametric, design, resolution, high, density, structure, optimization, robust",10,0.040439496782690945,0.2881487482820788,-2.6882401406234493,90
19150,0.1,0.05,3,0.1,2,1,10,"rate, viscoplastic, principle, continuum, equivalent, balance, recover, zero, theory, formulation",10,-0.07729279911934536,0.6977475706838895,-2.262505659455928,90
19151,0.1,0.05,3,0.1,2,1,10,"algorithm, configuration, decomposition, new, cluster, plastic, intermediate, elasticplastic, metal, calculate",10,0.0766315491700078,0.40672515684014404,-2.733278342425404,90
19152,0.1,0.05,3,0.1,2,1,10,"yield, surface, rod, crosssection, elastoplastic, discrete, determination, make, subject, uniform",10,-0.06722543531304047,0.3204554527012634,-2.6275634272040174,90
19153,0.1,0.05,3,0.1,2,1,10,"vfm, inverse, regularization, optimization, largescale, variation, identify, soft, identification, fullfield",10,-0.07033017800996053,0.8585387383401931,-2.3169187400127207,90
19154,0.1,0.05,3,0.1,2,1,10,"surface, wave, layer, dispersion, anisotropic, eigenvalue, towards, transfer, relationship, sufficient",10,-0.07915204782783429,0.3274814136222348,-3.0868037457460376,90
19155,0.1,0.05,3,0.1,2,1,10,"mode, vibration, dynamic, rod, external, efficient, modal, multilevel, power, assembly",10,-0.16189024594937534,0.5002475621951772,-2.7982069282904836,90
19156,0.1,0.05,3,0.1,2,2,10,"pd, nonlocal, instability, local, compression, wave, film, phenomenon, peridynamics, zero",10,-0.08609294996718556,0.7263973302210064,-2.529063456786656,90
19157,0.1,0.05,3,0.1,2,1,10,"pod, rom, basis, interpolation, value, st, temporal, part, matrix, curve",10,0.04702528467409676,0.6302771933483341,-2.229827353557512,90
19158,0.1,0.05,3,0.1,2,1,10,"data, storage, hyperreduction, cyclic, modeling, via, explore, novelty, preserve, compression",10,-0.10340764010974049,0.45458471833737646,-2.4344179987465457,90
19159,0.1,0.05,3,0.1,2,1,10,"error, adaptive, concept, fully, multiscale, guarantee, source, drive, output, nonintrusive",10,-0.14062061546567714,0.36799705802661564,-3.085368869456905,90
19160,0.1,0.05,3,0.1,2,1,10,"degree, freedom, approximation, steadystate, nonlinear, system, hybrid, approximate, difference, harmonic",10,-0.02143423633561496,0.46999648759465373,-2.6007154560868164,90
19161,0.1,0.05,3,0.1,2,1,10,"irregular, wall, structure, stochastic, random, analysis, deterministic, fea, inelastic, manifold",10,0.10708576170375246,0.6588310425950388,-2.7137223179813668,90
19162,0.1,0.05,3,0.1,2,2,10,"function, criterion, constraint, move, optimization, approximate, objective, method, explicit, approximation",10,0.0242291638849102,0.2747819499852372,-2.2092060285488953,90
19163,0.1,0.05,3,0.1,2,1,10,"uncertainty, body, multibody, forward, dynamic, human, rigid, simulation, graph, examine",10,0.02252500058799258,0.5152410184019861,-2.4301609658085668,90
19164,0.1,0.05,3,0.1,2,1,10,"data, train, network, comprise, constitutive, thereby, pure, ann, could, correspond",10,-0.08176714314790741,0.7877256156631451,-2.6035062500409385,90
19165,0.1,0.05,3,0.1,2,1,10,"crack, propagation, eg, voxel, still, mass, heterogeneous, decomposition, ductile, metallic",10,-0.10834365786169342,0.7491604359658071,-2.8872430653890078,90
19166,0.1,0.05,3,0.1,2,1,10,"computation, turbine, different, accuracy, twopart, article, wake, st, isogeometric, resolution",10,0.13173085176726756,0.7166455597642544,-2.0344029561562333,90
19167,0.1,0.05,3,0.1,2,1,10,"rotational, beam, solid, orientation, constraint, potential, embed, freedom, definition, consistently",10,0.04471082201242144,0.7536439466943406,-2.757274927789433,90
19168,0.1,0.05,3,0.1,2,1,10,"pore, formation, rate, cast, additive, manufacturing, identify, investigation, discuss, mechanism",10,0.17322762562264768,0.508120803775706,-2.305707810065353,90
19169,0.1,0.05,3,0.1,2,1,10,"particle, result, model, property, aspect, ratio, orientation, angle, fe, maximum",10,-0.01998039401237387,0.3086504155750835,-2.8320746633662406,90
