node_id,eta,gamma,depth,alpha,top_k,top_words,word_count,node_npmi,node_c_v,node_u_mass,global_npmi,global_c_v,global_u_mass,iteration,layer,document_count
22201,0.005,0.05,3,0.1,5,"functional, continuum, initial, temporal, investigated",5,-0.3802913955427212,0.2363224353322534,-3.2806778221353383,0.0465085063413163,0.566666382400682,-2.714874936534461,115,2,1
22202,0.005,0.05,3,0.1,5,"loading, volume, sve, local, damage",5,-0.140860515217615,0.6620844347445307,-2.129695645848489,0.0465085063413163,0.566666382400682,-2.714874936534461,115,2,1
22203,0.005,0.05,3,0.1,5,"rate, viscoplastic, strain, principle, case",5,0.0773258354218153,0.6962474100340539,-1.7876154949793055,0.0465085063413163,0.566666382400682,-2.714874936534461,115,2,2
22204,0.005,0.05,3,0.1,5,"nonlocal, operator, type, differential, second",5,0.3309072423461253,0.8510429779916725,-2.2539749380396383,0.0465085063413163,0.566666382400682,-2.714874936534461,115,2,1
22205,0.005,0.05,3,0.1,5,"property, constitutive, microstructural, fibre, produce",5,-0.1833594523968797,0.6056178597753765,-3.1464315087124666,0.0465085063413163,0.566666382400682,-2.714874936534461,115,2,1
22206,0.005,0.05,3,0.1,5,"density, highresolution, bound, level, inplane",5,-0.1588248448492051,0.3524119145996381,-2.549190057314455,0.0465085063413163,0.566666382400682,-2.714874936534461,115,2,2
22207,0.005,0.05,3,0.1,5,"source, approach, information, train, hierarchical",5,0.1830536092554699,0.6274670084306654,-2.721987016100522,0.0465085063413163,0.566666382400682,-2.714874936534461,115,2,1
22208,0.005,0.05,3,0.1,5,"cluster, inhomogeneity, rapidly, global, directly",5,-0.4430930679778174,0.6024788079505721,-2.301791536517068,0.0465085063413163,0.566666382400682,-2.714874936534461,115,2,1
22209,0.005,0.05,3,0.1,5,"vfm, inverse, regularization, optimization, available",5,0.1686495644495161,0.8173872183819897,-1.8552925942801088,0.0465085063413163,0.566666382400682,-2.714874936534461,115,2,1
22210,0.005,0.05,3,0.1,5,"system, thermal, reduction, fe, reducedorder",5,0.0252004473215108,0.4743265978362947,-3.045664929684899,0.0465085063413163,0.566666382400682,-2.714874936534461,115,2,1
22211,0.005,0.05,3,0.1,5,"metal, pinn, process, learning, machine",5,0.2527375710202502,0.7964353313925605,-1.9918946673624456,0.0465085063413163,0.566666382400682,-2.714874936534461,115,2,1
22212,0.005,0.05,3,0.1,5,"plate, rotation, support, transverse, assume",5,0.0867927780995703,0.5201804587672441,-2.485103361550508,0.0465085063413163,0.566666382400682,-2.714874936534461,115,2,2
22213,0.005,0.05,3,0.1,5,"type, smooth, domain, incompressible, property",5,0.0021638234336455,0.2889111247861107,-2.5238735932586813,0.0465085063413163,0.566666382400682,-2.714874936534461,115,2,1
22214,0.005,0.05,3,0.1,5,"strain, input, ability, viscoelasticity, dimensional",5,-0.019739883619949,0.4466994678965639,-3.097124069416926,0.0465085063413163,0.566666382400682,-2.714874936534461,115,2,1
22215,0.005,0.05,3,0.1,5,"manifold, motion, estimation, know, learn",5,0.0929888586773479,0.2291283105006178,-2.4952810098104505,0.0465085063413163,0.566666382400682,-2.714874936534461,115,2,1
22216,0.005,0.05,3,0.1,5,"mode, dynamic, vibration, model, efficient",5,0.0465842355241819,0.4747073899831683,-1.5862146338598722,0.0465085063413163,0.566666382400682,-2.714874936534461,115,2,1
22217,0.005,0.05,3,0.1,5,"pod, rom, basis, interpolation, st",5,0.2889699191905219,0.6925197856524838,-1.8420613081021635,0.0465085063413163,0.566666382400682,-2.714874936534461,115,2,2
22218,0.005,0.05,3,0.1,5,"fatigue, load, energy, fracture, accumulation",5,0.1257387692034269,0.5024912857153272,-2.595156899159904,0.0465085063413163,0.566666382400682,-2.714874936534461,115,2,1
22219,0.005,0.05,3,0.1,5,"data, storage, via, hyperreduction, cyclic",5,0.0191531058200628,0.5554126747096305,-2.940353904199342,0.0465085063413163,0.566666382400682,-2.714874936534461,115,2,1
22220,0.005,0.05,3,0.1,5,"uncertainty, one, adaptive, bayesian, optimization",5,0.1371453646071707,0.5677497301391357,-2.439530758383808,0.0465085063413163,0.566666382400682,-2.714874936534461,115,2,1
22221,0.005,0.05,3,0.1,5,"macroscopic, phase, fluctuation, field, representation",5,0.1400951182812119,0.5661904634112955,-2.2493661422394533,0.0465085063413163,0.566666382400682,-2.714874936534461,115,2,1
22222,0.005,0.05,3,0.1,5,"module, thermal, pgd, algorithm, exhibit",5,-0.0719978482956846,0.3279550422098989,-2.2020961371322416,0.0465085063413163,0.566666382400682,-2.714874936534461,115,2,1
22223,0.005,0.05,3,0.1,5,"stabilizer, shell, dynamic, analysis, fatigue",5,0.1614588402666101,0.7678720462004403,-1.6174623428423716,0.0465085063413163,0.566666382400682,-2.714874936534461,115,2,1
22224,0.005,0.05,3,0.1,5,"crack, heat, framework, phasefield, fracture",5,0.1081660616339033,0.6932350259760203,-1.7620118671333675,0.0465085063413163,0.566666382400682,-2.714874936534461,115,2,1
22225,0.005,0.05,3,0.1,5,"interface, orthotropic, adhesive, effect, contact",5,0.1556412019947401,0.5183690340470883,-2.2552271379833577,0.0465085063413163,0.566666382400682,-2.714874936534461,115,2,1
22226,0.005,0.05,3,0.1,5,"composite, recover, thermoelastic, multiscale, correlation",5,-0.0742461254753575,0.5008867666698379,-2.855266665188796,0.0465085063413163,0.566666382400682,-2.714874936534461,115,2,1
22227,0.005,0.05,3,0.1,5,"degree, freedom, approximation, system, steadystate",5,0.2027547290020774,0.560303492727968,-2.567643225578212,0.0465085063413163,0.566666382400682,-2.714874936534461,115,2,1
22228,0.005,0.05,3,0.1,5,"warp, mode, technique, nonuniform, higherorder",5,0.182702627286234,0.1977998020861157,-2.1816794924602503,0.0465085063413163,0.566666382400682,-2.714874936534461,115,2,1
22229,0.005,0.05,3,0.1,5,"local, globallocal, global, element, behaviour",5,0.1058731396005344,0.7119656073666394,-1.6026571668735454,0.0465085063413163,0.566666382400682,-2.714874936534461,115,2,1
22230,0.005,0.05,3,0.1,5,"element, plate, virtual, vem, traditional",5,0.1033231237468945,0.6016026364221823,-2.801015101295857,0.0465085063413163,0.566666382400682,-2.714874936534461,115,2,1
22231,0.005,0.05,3,0.1,5,"boundary, treatment, numerical, shock, fractional",5,0.1048256711024505,0.5215288830668532,-3.092970867626613,0.0465085063413163,0.566666382400682,-2.714874936534461,115,2,1
22232,0.005,0.05,3,0.1,5,"condition, pod, particle, interpolation, stability",5,-0.0195704250354237,0.4736610939754846,-4.661427993208694,0.0465085063413163,0.566666382400682,-2.714874936534461,115,2,2
22233,0.005,0.05,3,0.1,5,"smooth, quality, position, free, hence",5,0.1536477088288138,0.4019481583418985,-2.829709776265449,0.0465085063413163,0.566666382400682,-2.714874936534461,115,2,1
22234,0.005,0.05,3,0.1,5,"print, laser, path, structure, deep",5,-0.0608145640085132,0.579614551559247,-1.9715180770238991,0.0465085063413163,0.566666382400682,-2.714874936534461,115,2,1
22235,0.005,0.05,3,0.1,5,"identification, real, surrogate, parameter, pgd",5,0.1639847977556089,0.8802735994705067,-2.273872052552239,0.0465085063413163,0.566666382400682,-2.714874936534461,115,2,1
22236,0.005,0.05,3,0.1,5,"loss, function, pinn, neural, network",5,0.2517322605151166,0.658161837289925,-2.246660742793696,0.0465085063413163,0.566666382400682,-2.714874936534461,115,2,1
22237,0.005,0.05,3,0.1,5,"dissipation, solver, mechanism, trace, integral",5,-0.026101912757036,0.648555250283096,-2.735671799069139,0.0465085063413163,0.566666382400682,-2.714874936534461,115,2,1
22238,0.005,0.05,3,0.1,5,"elastoplastic, datadriven, asymmetric, directly, data",5,0.0393083160774862,0.4540599522223126,-2.1855911240509007,0.0465085063413163,0.566666382400682,-2.714874936534461,115,2,1
22239,0.005,0.05,3,0.1,5,"distribution, fiber, generate, length, describe",5,-0.0015176767096715,0.3319372559226989,-2.5394966688749885,0.0465085063413163,0.566666382400682,-2.714874936534461,115,2,1
22240,0.005,0.05,3,0.1,5,"beam, solid, constraint, freedom, degree",5,0.1362138111879336,0.692281069039748,-1.838872480990824,0.0465085063413163,0.566666382400682,-2.714874936534461,115,1,1
22241,0.005,0.05,3,0.1,5,"rotational, orientation, potential, embed, continuum",5,-0.0532265632164338,0.7885746907702217,-2.5371241547069734,0.0465085063413163,0.566666382400682,-2.714874936534461,115,2,1
22242,0.005,0.05,3,0.1,5,"evaluation, differentiation, simplify, automatic, effort",5,0.1500884841878108,0.5513924611771708,-2.7093309068096305,0.0465085063413163,0.566666382400682,-2.714874936534461,115,2,1
22243,0.005,0.05,3,0.1,5,"viscoelastic, test, variable, viscoelasticity, load",5,0.0066156819983007,0.4707723864124133,-2.2366094354006494,0.0465085063413163,0.566666382400682,-2.714874936534461,115,2,1
22244,0.005,0.05,3,0.1,5,"mechanical, increase, understand, performance, concentration",5,0.0139315188111802,0.459192557266304,-2.8728424321255424,0.0465085063413163,0.566666382400682,-2.714874936534461,115,2,2
