node_id,eta,gamma,depth,alpha,layer,document_count,top_k,top_words,word_count,node_npmi,node_c_v,node_u_mass,iteration
0,0.1,0.05,3,0.1,0,970,10,"method, model, use, element, propose, numerical, problem, finite, present, base",10,0.021117008955801656,0.4645876303814645,-0.6924507757945375,155
1,0.1,0.05,3,0.1,1,355,10,"model, data, computational, approach, use, material, stochastic, reduce, reduction, uncertainty",10,0.04286732104340863,0.5084122640770874,-1.9230617004191422,155
10,0.1,0.05,3,0.1,2,10,10,"time, scheme, integration, explicit, oscillation, step, particle, critical, stability, investigate",10,0.017506163672123907,0.44168270599693854,-2.289566492674171,155
322,0.1,0.05,3,0.1,1,6,10,"mass, matrix, order, formulation, superconvergent, high, three, frequency, wave, dimensional",10,0.15045771758107124,0.578972485646002,-2.348982208275558,155
75,0.1,0.05,3,0.1,2,5,10,"cell, quadrature, integration, moment, pressure, rule, weight, scheme, fit, generation",10,0.01901042018114376,0.4620376642720121,-3.787095343131358,155
2,0.1,0.05,3,0.1,2,17,10,"contact, formulation, mortar, friction, mesh, element, surface, beam, approach, constraint",10,-0.009160493239358792,0.35388467928117096,-2.1993981689231767,155
50,0.1,0.05,3,0.1,2,7,10,"process, predict, part, additive, manufacturing, microstructure, build, residual, stress, mechanic",10,0.1450466186603888,0.7233556853934464,-1.9631179385602404,155
3,0.1,0.05,3,0.1,2,84,10,"material, model, microstructure, crack, composite, response, homogenization, scale, failure, damage",10,0.06377777568109799,0.6520366905717295,-1.917353033657846,155
3143,0.1,0.05,3,0.1,2,2,10,"mesh, dual, material, standard, use, model, unstructured, simplicity, primal, quality",10,-0.019761100150104013,0.44344663971436915,-2.470474561940291,155
631,0.1,0.05,3,0.1,2,13,10,"crack, xfem, pd, fracture, tip, approximation, propagation, strategy, phasefield, domain",10,0.060467248096551074,0.559346836194197,-1.7549755070361739,155
1076,0.1,0.05,3,0.1,2,3,10,"surface, peridynamic, theory, nonlocal, bulk, effect, near, elasticity, body, boundary",10,0.07625895512823944,0.27017548114480455,-2.7103945810654997,155
76,0.1,0.05,3,0.1,2,8,10,"process, material, manufacturing, additive, manufacture, modeling, component, due, print, effective",10,-0.008510637520681227,0.4622344789407446,-2.295334897010823,155
552,0.1,0.05,3,0.1,2,8,10,"kernel, formulation, approximation, shock, reproduce, integration, finescale, conform, meshfree, variational",10,0.000847836245362394,0.4783975887353941,-4.092172928249713,155
197,0.1,0.05,3,0.1,2,5,10,"flow, simulation, framework, navierstokes, turbulent, compressible, move, formulation, experimental, agreement",10,-0.03584517831627476,0.3568072505453804,-2.094326693277919,155
125,0.1,0.05,3,0.1,2,3,10,"mesh, element, cisamr, structure, conform, node, refinement, algorithm, phase, aspect",10,0.1333638337050367,0.531129471231134,-2.0701235898064683,155
250,0.1,0.05,3,0.1,2,6,10,"isogeometric, contact, lr, nurbs, refinement, surface, analysis, local, bsplines, hierarchical",10,0.11983771137394211,0.5148813788681784,-2.4346887562231583,155
81,0.1,0.05,3,0.1,1,15,10,"instability, membrane, symmetry, thin, mode, stability, affect, response, pressure, whole",10,-0.018542893918218076,0.3688136260518699,-2.3311808024831735,155
168,0.1,0.05,3,0.1,2,15,10,"fracture, model, damage, phasefield, crack, strain, brittle, evolution, ductile, specimen",10,0.10246659425808696,0.6612216879565782,-2.160938708025341,155
183,0.1,0.05,3,0.1,2,9,10,"equation, fractional, differential, function, derivative, solve, diffusion, pressure, basis, order",10,0.10930969043176358,0.5104013546194625,-1.8833240213448312,155
622,0.1,0.05,3,0.1,2,3,10,"structural, identification, response, input, signal, adopt, modal, full, excitation, strategy",10,0.10805191294598553,0.5922559809110549,-2.1286367412114204,155
174,0.1,0.05,3,0.1,2,4,10,"element, rod, interpolation, incremental, shell, rotation, angle, lagrange, simple, make",10,0.12206517057615048,0.33652100273514074,-2.223864053960402,155
260,0.1,0.05,3,0.1,1,10,10,"damage, free, establish, variable, local, nonlocal, energy, additional, govern, global",10,-0.047957358126537813,0.3139592549928287,-2.892107961097947,155
148,0.1,0.05,3,0.1,2,7,10,"spacetime, matrix, enrichment, algorithm, product, equation, system, accelerate, vector, iterative",10,0.03812214635119475,0.37733221974366193,-2.7429207866992784,155
51,0.1,0.05,3,0.1,1,11,10,"stress, element, shell, static, resultant, plate, equation, displacement, term, additional",10,0.03869089922193794,0.6071004763903306,-1.8922112351051594,155
330,0.1,0.05,3,0.1,1,8,10,"multifield, bem, make, form, bend, micro, electrical, actuator, gain, lagrangian",10,-0.33848122802425057,0.4986834119691331,-4.5132371189115,155
2785,0.1,0.05,3,0.1,2,5,10,"material, lattice, data, cubic, approach, neural, network, two, symmetry, model",10,0.056501280506073816,0.5791447139956498,-1.7865413121551121,155
662,0.1,0.05,3,0.1,2,5,10,"element, mesh, tetrahedral, hexahedral, linear, quadratic, discontinuous, hybrid, generation, grain",10,0.06897952565319151,0.42217390560776674,-3.572767681938664,155
232,0.1,0.05,3,0.1,2,8,10,"function, method, constraint, optimization, deep, topology, set, network, neural, hierarchical",10,-0.015276906414546475,0.34090885753850486,-2.678520384230995,155
2777,0.1,0.05,3,0.1,1,5,10,"tire, domain, noise, frequency, geometry, harden, neumann, equation, acoustic, galerkin",10,-0.13367930066744538,0.3201799703451323,-4.848613101487401,155
62,0.1,0.05,3,0.1,1,13,10,"drug, tissue, viscous, relaxation, system, concentration, remain, multiphysics, robust, mechanical",10,-0.10210902552770151,0.33295649651393755,-4.115401794656197,155
206,0.1,0.05,3,0.1,2,6,10,"element, displacement, stress, shear, plate, rotation, independent, approximation, variable, theory",10,0.07382707528419086,0.5199948561333181,-1.9888657258882791,155
660,0.1,0.05,3,0.1,2,11,10,"fe, homogenization, scale, microscopic, micro, macroscopic, sensitivity, variational, computational, composite",10,0.08692597064199382,0.5995031303110095,-2.2339113467290406,155
1262,0.1,0.05,3,0.1,1,6,10,"condition, pod, interpolation, rom, stability, monolithic, hybrid, manifold, basis, map",10,-0.07257018368214269,0.38415348986119235,-5.877728305133407,155
4306,0.1,0.05,3,0.1,2,4,10,"boundary, mixed, reinforce, fiber, fix, gradient, orthogonal, positive, laminate, article",10,-0.22296722434816,0.4078644615869065,-2.7800442866999773,155
1571,0.1,0.05,3,0.1,1,10,10,"system, linear, use, solution, number, vector, homogenization, iterative, algebraic, matrix",10,-0.024262378671179245,0.35973534158641113,-2.321090508727708,155
843,0.1,0.05,3,0.1,1,6,10,"geometric, imperfection, defect, system, inverse, response, test, compressive, know, extract",10,0.14516106053704445,0.4602293638891385,-2.3456676372660548,155
862,0.1,0.05,3,0.1,1,23,10,"incompressible, formulation, nearly, pair, robustness, three, flux, hybrid, discontinuous, lockingfree",10,-0.17795775644311201,0.4611556158188638,-3.916198386963747,155
2838,0.1,0.05,3,0.1,2,3,10,"beam, theory, nonlocal, bend, response, static, core, fractional, grade, must",10,-0.020519176478096184,0.46897219471195245,-2.8624349551340953,155
59,0.1,0.05,3,0.1,1,17,10,"shell, thin, approximation, plate, form, galerkin, importantly, separate, reissnermindlin, underlie",10,-0.12963840641810262,0.483181653650128,-3.717208489646134,155
2201,0.1,0.05,3,0.1,2,5,10,"particle, contact, shape, dem, discrete, distance, force, approach, granular, influence",10,0.038827378273954535,0.5723088497396319,-2.0708078517409465,155
4313,0.1,0.05,3,0.1,1,9,10,"element, polynomial, highorder, spectral, even, scm, basis, reference, applicability, function",10,-0.17135468021609795,0.30095186483002556,-4.711375554359134,155
39,0.1,0.05,3,0.1,2,13,10,"optimization, topology, design, two, structure, sensitivity, shape, parameterized, parametric, reduce",10,0.042782448102247544,0.39851372070145624,-2.2487890586297192,155
369,0.1,0.05,3,0.1,1,15,10,"incompressible, lock, nearly, lockingfree, strain, elasticity, cost, converge, follow, three",10,-0.06599459525986576,0.38830645496965077,-3.0581884594280715,155
645,0.1,0.05,3,0.1,2,11,10,"element, mode, interface, modal, analysis, displacement, derive, static, frequency, nonlinear",10,0.018757600748103502,0.40868255599613273,-2.1307290588029906,155
4687,0.1,0.05,3,0.1,1,2,10,"band, acoustic, structure, displacement, reducedorder, rom, complex, frequency, introduce, system",10,0.0477833032054977,0.569531861466835,-2.026730345447258,155
4417,0.1,0.05,3,0.1,2,3,10,"mesh, fluid, move, fsi, interaction, technique, deformation, partition, motion, equation",10,0.05162560376183263,0.5672545041099705,-1.8472568340324464,155
25,0.1,0.05,3,0.1,1,16,10,"fiber, volume, distribution, fraction, algorithm, composite, orientation, generate, aspect, ratio",10,0.12182712158605927,0.44695610641926053,-2.7363515226390467,155
4,0.1,0.05,3,0.1,2,7,10,"sph, particle, smooth, simulation, surface, flow, incompressible, free, instability, mixed",10,0.049490260881688876,0.5121208998316271,-2.5908735315055984,155
2419,0.1,0.05,3,0.1,2,4,10,"contact, point, stable, surface, form, smoothed, spherical, element, region, smooth",10,0.02951733877488222,0.4589494892949566,-2.206085466619884,155
2199,0.1,0.05,3,0.1,1,4,10,"yield, stress, function, rod, plastic, elastoplastic, make, elastic, crosssection, respect",10,0.02161558005745995,0.47328507114390506,-2.4473262347880977,155
14,0.1,0.05,3,0.1,1,17,10,"rotation, element, beam, present, formulation, shell, vector, displacement, freedom, degree",10,0.11427315760142487,0.618099923176619,-1.6375060664185566,155
1214,0.1,0.05,3,0.1,2,5,10,"element, virtual, part, vem, different, consider, plate, approximation, comput, mech",10,0.06254609864073697,0.4728068480789716,-2.28226737001475,155
4870,0.1,0.05,3,0.1,1,10,10,"micromorphic, continuum, metamaterials, x, material, wellknown, solver, nonsymmetric, stem, central",10,-0.25352003571538306,0.3189537690873279,-8.103043383022644,155
452,0.1,0.05,3,0.1,2,6,10,"shell, rkpm, kernel, function, meshfree, beam, shape, reproduce, particle, derive",10,0.11983981882251898,0.5814407913870934,-1.8287809092096194,155
1874,0.1,0.05,3,0.1,2,9,10,"contact, surface, solution, algorithm, inhomogeneity, adhesive, comparison, direction, rough, fast",10,-0.03764495784594019,0.5696972106912083,-3.0788203830716228,155
181,0.1,0.05,3,0.1,2,4,10,"cluster, interaction, reduce, property, analysis, minimum, complementary, order, principle, et",10,0.07537573319602744,0.5213871868385397,-2.2295011993688605,155
2213,0.1,0.05,3,0.1,2,10,10,"system, framework, energy, electrical, provide, multiple, overall, develop, illustrate, release",10,0.008940334603514684,0.4028627494213174,-2.9000496630006762,155
1417,0.1,0.05,3,0.1,1,10,10,"object, error, deformable, approximate, realtime, exploit, cause, less, gap, human",10,-0.27464945736140545,0.42272557624766893,-2.7932261347764067,155
4501,0.1,0.05,3,0.1,1,6,10,"effect, well, flow, property, hydrodynamics, study, system, coefficient, power, biological",10,-0.0642761760938032,0.22825433651434196,-2.7881713758246245,155
1773,0.1,0.05,3,0.1,2,6,10,"shell, fracture, formulation, phase, lock, thin, field, alleviate, brittle, thickness",10,0.0626576212712974,0.5224800789235231,-2.3427772171838965,155
516,0.1,0.05,3,0.1,2,3,10,"anisotropic, crack, fracture, material, energy, toughness, behavior, phasefield, path, xfem",10,0.1304889309767684,0.5886323971211036,-2.3081143662406123,155
29,0.1,0.05,3,0.1,2,9,10,"model, covid, disease, number, spread, pandemic, new, dynamic, case, population",10,0.13043567725574828,0.596026566444148,-2.387401716745071,155
1634,0.1,0.05,3,0.1,2,5,10,"error, basis, adaptive, estimation, estimate, computation, quantity, bound, context, sample",10,-0.07290553190787415,0.4149675071913677,-2.3674374620021563,155
2189,0.1,0.05,3,0.1,2,7,10,"contact, crack, formulation, fracture, thermal, framework, thermomechanical, phasefield, surface, process",10,0.0339006922168492,0.43261672481215474,-2.086363173268735,155
297,0.1,0.05,3,0.1,1,7,10,"freedom, bend, rod, smooth, rotational, couple, interpolate, bspline, concept, curvature",10,-0.09729245538541101,0.45585763887950215,-2.6948169268651236,155
178,0.1,0.05,3,0.1,2,5,10,"contact, body, interaction, rigid, local, pointwise, problem, useful, scenario, surface",10,-0.0007100802700148367,0.44204206341157004,-2.046460964761211,155
1024,0.1,0.05,3,0.1,1,7,10,"basis, reduction, error, pod, bound, decomposition, low, stress, pure, orthogonal",10,-0.0037323692443961844,0.4287726944563134,-2.7468771568361334,155
101,0.1,0.05,3,0.1,1,33,10,"melt, laser, process, powder, result, experimental, slm, volume, different, particle",10,0.061222892929907194,0.6455198404081295,-1.5295981250931325,155
1403,0.1,0.05,3,0.1,1,6,10,"plane, subdomain, velocity, provide, nature, make, cost, article, computationally, temporal",10,-0.16814638000912074,0.7339288012611441,-2.0687837094371413,155
3978,0.1,0.05,3,0.1,1,10,10,"interface, nonmatching, voxel, region, fourier, discretizations, patch, pass, occur, different",10,-0.16360337632384395,0.30021663010532523,-7.600606952339627,155
3750,0.1,0.05,3,0.1,2,4,10,"mesh, rubber, flow, change, step, turbine, st, material, process, challenge",10,-0.07828328200515694,0.2985397885020379,-5.2794306507482895,155
2512,0.1,0.05,3,0.1,1,7,10,"crack, function, shape, field, xfem, fracture, element, phase, integration, node",10,-0.022638491695322192,0.3685002142956143,-2.4367326437591537,155
4939,0.1,0.05,3,0.1,2,5,10,"composite, damage, crack, cohesive, delamination, fracture, laminate, zone, interfacial, fft",10,0.08966911606844595,0.6736119973626419,-2.6695691943362423,155
5082,0.1,0.05,3,0.1,1,3,10,"time, rate, thermal, heat, band, implicit, step, formula, shear, conductivity",10,-0.06223364933286599,0.7198556600717897,-3.0821493176763948,155
5085,0.1,0.05,3,0.1,2,6,10,"boundary, condition, lattice, function, kernel, dynamic, arbitrary, absorb, representation, molecular",10,0.005902727651401706,0.3910017565362987,-3.647029897074816,155
5112,0.1,0.05,3,0.1,1,2,10,"solid, degradation, equation, immerse, rate, poroelastic, fluid, mechanical, product, pdes",10,-0.002318194415015561,0.5000830013391624,-2.6461681542577122,155
5326,0.1,0.05,3,0.1,2,4,10,"collocation, meshless, homogeneous, mixed, solution, least, square, approximation, heterogeneous, move",10,-0.045734070724206106,0.5098317801672623,-1.9412609531509932,155
5332,0.1,0.05,3,0.1,1,9,10,"shell, outofplane, midsurface, surface, present, location, account, deformation, also, specify",10,0.0713893157041,0.26132608130206036,-1.905767543501328,155
5802,0.1,0.05,3,0.1,1,12,10,"error, refinement, mesh, local, approximation, criterion, estimate, estimation, automatically, cut",10,-0.029786634237763326,0.2263654808682951,-3.681724275429496,155
6260,0.1,0.05,3,0.1,2,4,10,"mixed, pressure, phasefield, displacement, variable, approximation, incompressible, stabilize, fracture, stable",10,-0.015381648063435997,0.47965431222794086,-2.2662820336646305,155
6422,0.1,0.05,3,0.1,1,6,10,"target, multiscale, examine, human, output, modify, movement, considers, fix, uncertain",10,-0.29378634682258503,0.37210995894177934,-3.929595078255261,155
6539,0.1,0.05,3,0.1,2,5,10,"cut, process, metal, particle, contact, optimization, form, nodal, criterion, lagrangian",10,-0.11720500784082481,0.24832114624753032,-4.347477957521852,155
6611,0.1,0.05,3,0.1,1,13,10,"discrete, cell, bridge, wind, simplicity, damp, relative, conclude, tool, aerodynamic",10,-0.21075524423011172,0.3550244693089799,-7.560042610064792,155
7109,0.1,0.05,3,0.1,1,7,10,"response, multiscale, macroscale, microscale, macroscopic, effective, characteristic, largescale, variable, simulation",10,0.03616084818886403,0.5597717395706817,-2.0425916878801145,155
7129,0.1,0.05,3,0.1,2,6,10,"phase, crack, field, tire, propagation, st, contact, failure, cohesive, car",10,-0.17628701318962456,0.19152543122685314,-9.397713042969054,155
7154,0.1,0.05,3,0.1,1,4,10,"deposition, transmission, load, particle, unlike, group, finding, select, anisotropic, covid",10,-0.19313577659582848,0.4909100473286793,-2.9503649006840376,155
7290,0.1,0.05,3,0.1,1,12,10,"metal, pinn, data, edge, beam, learning, polynomial, mapping, application, machine",10,-0.18168250005897177,0.2230350982984406,-8.43422430437022,155
7293,0.1,0.05,3,0.1,1,7,10,"temperature, tissue, damage, effect, procedure, conservation, increase, twoscale, thermodynamic, fraction",10,-0.10203377873432762,0.24456334619802816,-4.817138744510298,155
7328,0.1,0.05,3,0.1,2,5,10,"magnetic, tire, computation, dynamic, multibody, flow, st, uncertainty, body, highresolution",10,-0.1628623727679178,0.31863541636408815,-9.43923097162202,155
7541,0.1,0.05,3,0.1,1,5,10,"erosion, update, analysis, particle, computational, scale, dynamic, step, base, flow",10,0.04156330321377632,0.3453981008335649,-1.4977343213609395,155
7751,0.1,0.05,3,0.1,2,7,10,"fluid, medium, dynamic, free, motion, granular, employ, wing, water, study",10,0.003522538778945831,0.36959453104757406,-3.7837686273255096,155
7831,0.1,0.05,3,0.1,1,11,10,"fiber, orientation, effective, state, reinforce, surrogate, model, short, firstly, single",10,0.01700610491092848,0.7095734142323973,-2.4489969600371566,155
7837,0.1,0.05,3,0.1,1,13,10,"turbine, blade, analysis, shell, structure, wind, frequency, structural, disk, concern",10,0.09385118011211671,0.3880837764437447,-3.5838256320463997,155
8065,0.1,0.05,3,0.1,1,9,10,"appl, mech, comput, eng, al, et, viscoelastic, develop, cardiac, damage",10,0.09877503666132659,0.609275207226146,-2.727607284636494,155
8833,0.1,0.05,3,0.1,1,16,10,"strain, experimental, rate, dislocation, data, stress, yield, criterion, describe, back",10,-0.11374528067677006,0.4080478098050212,-3.0448551433448876,155
8863,0.1,0.05,3,0.1,2,2,10,"fractional, diffusion, element, equation, oscillation, finite, enrich, galerkin, spatial, term",10,0.13514888116506749,0.5556711578938577,-2.0102313742606217,155
9042,0.1,0.05,3,0.1,1,7,10,"model, fundamental, understanding, useful, covid, propagation, herein, focus, kernel, quantity",10,-0.17364689396028873,0.3378900387893795,-4.8871699993969315,155
9068,0.1,0.05,3,0.1,1,14,10,"formulation, mixed, mesh, failure, identification, displacement, compressible, real, capacity, mechanism",10,-0.16798971263041465,0.2626206046186784,-6.236739821481759,155
9641,0.1,0.05,3,0.1,1,10,10,"surface, powder, stress, manufacturing, laser, beam, track, positive, additive, detail",10,-0.001472328841809221,0.5590278021988138,-2.3475556209840045,155
9687,0.1,0.05,3,0.1,2,4,10,"strain, localization, plane, plasticity, angle, stress, plastic, condition, soften, independent",10,0.13493600085316132,0.6858670143923317,-2.5658116182404616,155
9871,0.1,0.05,3,0.1,1,7,10,"gradient, plastic, single, influence, defect, dislocation, discontinuous, accumulate, tensile, elasticplastic",10,-0.17452743574057045,0.24328620628015965,-5.786576614174251,155
9905,0.1,0.05,3,0.1,2,8,10,"virtual, vem, problem, element, last, loworder, elasticity, plasticity, strain, work",10,0.14428321530114788,0.521604399649684,-1.725067919028632,155
10085,0.1,0.05,3,0.1,2,6,10,"cell, within, data, process, tissue, differentiation, mechanical, control, stress, stiffness",10,-0.039424030495503574,0.4182141175447871,-2.861705313987661,155
10430,0.1,0.05,3,0.1,2,6,10,"shear, warp, layer, thickness, shape, constraint, freedom, surface, subject, consider",10,-0.03287715288802458,0.6127353639742461,-1.7570024406602784,155
11153,0.1,0.05,3,0.1,1,3,10,"experimental, material, shape, without, parameter, energy, data, hyperelastic, hyperelasticity, fit",10,0.019231853047661812,0.33623912534316625,-2.6772540561730147,155
11663,0.1,0.05,3,0.1,2,5,10,"enrichment, function, gxfem, globallocal, local, problem, crack, global, obtain, rate",10,0.12880596357665297,0.6741876657961857,-1.4839072337035593,155
11988,0.1,0.05,3,0.1,2,4,10,"datadriven, constitutive, data, simulation, law, stressstrain, manifold, tangent, set, extract",10,0.03485499996366444,0.43866010386553633,-3.1797390814222535,155
13277,0.1,0.05,3,0.1,1,7,10,"viscosity, explore, model, active, highly, stiffness, internal, stress, family, finescale",10,-0.059763325244867105,0.2943849927865726,-5.907327428997346,155
13320,0.1,0.05,3,0.1,2,4,10,"computation, turbine, st, flow, computational, stvms, framework, discretization, isogeometric, multiscale",10,0.21423255831698357,0.7838134783354324,-1.144795329498106,155
13447,0.1,0.05,3,0.1,1,11,10,"finiteelement, overall, phase, deformation, separate, move, front, incorporate, metric, real",10,-0.15007709804500574,0.30038381741086284,-6.973580668828698,155
13817,0.1,0.05,3,0.1,1,13,10,"bem, fast, new, matrix, solve, solver, multidomain, hierarchical, coefficient, direct",10,0.139798010082203,0.40698593337910677,-3.446858819284258,155
14113,0.1,0.05,3,0.1,1,5,10,"design, train, optimal, drag, shape, new, optimization, third, object, performance",10,0.05170452975322056,0.4097731136421707,-2.269857971257567,155
14139,0.1,0.05,3,0.1,1,14,10,"article, formulation, classical, curvature, author, motivate, original, stretch, acoustic, graph",10,-0.25199231413880485,0.2145265722249739,-8.631203850168529,155
14175,0.1,0.05,3,0.1,2,2,10,"probability, system, density, evolution, stochastic, equation, galerkin, generalize, rkpm, addition",10,0.0355211194919067,0.5206766626265538,-2.8982644648217155,155
14176,0.1,0.05,3,0.1,2,5,10,"random, structure, stochastic, field, irregular, wall, reliability, analysis, dynamic, subject",10,0.04158324306136588,0.38506658801382543,-3.2743328409216494,155
14342,0.1,0.05,3,0.1,2,3,10,"material, optimization, multiscale, design, lattice, thermoelastic, structure, microstructure, topology, concurrent",10,0.050377062304498677,0.5340280430170191,-2.432389703496268,155
14440,0.1,0.05,3,0.1,2,5,10,"strain, lock, solidshell, element, tensor, natural, inhomogeneous, various, modify, assume",10,0.06481903331767272,0.6054368968528997,-2.1898631105185427,155
14462,0.1,0.05,3,0.1,2,3,10,"virtual, field, parameter, strain, data, identification, test, material, influence, determination",10,-0.019923243478914297,0.39672398190100855,-2.757893787911124,155
14487,0.1,0.05,3,0.1,2,5,10,"eng, term, et, al, comput, j, mech, three, show, appl",10,0.17885805720345319,0.7898124089626726,-1.327016362544261,155
14501,0.1,0.05,3,0.1,1,12,10,"mesh, approach, random, enrichment, use, crack, fracture, analyse, hexahedral, finescale",10,-0.031302775904430064,0.5114148035249999,-4.274326845918238,155
14588,0.1,0.05,3,0.1,1,4,10,"model, damage, crack, shear, concrete, degree, freedom, element, local, node",10,-0.04033508552868269,0.3805467077713793,-1.9707737815519901,155
14634,0.1,0.05,3,0.1,2,3,10,"mesh, generation, present, geometry, complex, quality, rve, methodology, conform, distance",10,0.0050091679247729415,0.3416946507850919,-2.6399626513026324,155
15056,0.1,0.05,3,0.1,1,8,10,"fsi, rkpm, paper, part, class, air, discretizations, iga, methodology, solid",10,-0.10442391680205779,0.4614330699873542,-2.0351124718552116,155
15130,0.1,0.05,3,0.1,1,5,10,"implicit, crystal, evaluate, procedure, whole, transform, yield, polycrystalline, sample, exponential",10,-0.2109452702243875,0.306499010088939,-4.783427073161695,155
15178,0.1,0.05,3,0.1,2,2,10,"element, shell, thickness, additional, propose, surface, interface, stress, direction, solid",10,0.019928068454863834,0.44722509576571234,-1.8251150165972594,155
15220,0.1,0.05,3,0.1,1,4,10,"output, weight, ann, desire, process, represent, data, calibration, function, select",10,0.10884344044344287,0.32916656957141144,-2.10199484313223,155
15463,0.1,0.05,3,0.1,2,3,10,"modulus, surface, inhomogeneity, effective, composite, interphase, bend, end, influence, interface",10,-0.016972272061019936,0.30335587498866273,-3.189917359625485,155
15671,0.1,0.05,3,0.1,2,4,10,"crystal, orientation, spectral, polycrystalline, microstructure, memory, solver, solution, grain, fourier",10,-0.1646706389944555,0.5602119532776555,-2.686119144379177,155
15740,0.1,0.05,3,0.1,2,3,10,"derivative, approximation, reproduce, kernel, collocation, gradient, scm, direct, construct, pdes",10,0.1382856787218335,0.563644029918578,-2.901284960411029,155
15741,0.1,0.05,3,0.1,2,3,10,"plastic, decomposition, part, elastoplastic, strain, multiplicative, write, flow, direction, total",10,-0.01614127553321002,0.3982978773230371,-2.403060577886895,155
15872,0.1,0.05,3,0.1,2,6,10,"interface, algorithm, lagrange, multiplier, localized, heterogeneous, mixed, across, primal, functional",10,-0.02518662740758508,0.5908786706089637,-2.6325199267923862,155
16020,0.1,0.05,3,0.1,2,2,10,"void, pressure, formation, influence, boundary, approach, macroscopic, reinforcement, evolution, dual",10,-0.1296984530331918,0.45548112746887554,-2.850006464355735,155
16135,0.1,0.05,3,0.1,1,10,10,"alternative, al, et, j, allow, framework, int, life, biological, coalescence",10,-0.10642766578820759,0.40846394825116655,-3.961432989067642,155
16260,0.1,0.05,3,0.1,1,6,10,"property, smooth, wall, type, rigid, patientspecific, different, important, incompressible, spectral",10,-0.23116974126644294,0.19129150330253109,-5.75778947943629,155
16316,0.1,0.05,3,0.1,2,3,10,"reduction, contact, multiplier, lagrange, interface, preserve, reduce, internal, dual, constraint",10,0.06543280299751456,0.3870928083306528,-2.3490900706004822,155
16318,0.1,0.05,3,0.1,2,4,10,"wave, structure, periodic, mass, field, imperfection, dispersion, propagation, method, fourier",10,-0.05658740976681831,0.3551377621573445,-5.082918150001004,155
16435,0.1,0.05,3,0.1,2,3,10,"fiber, solid, fiberreinforced, beam, embed, reinforce, penalty, volume, anisotropic, analytical",10,-0.041820648812765815,0.4782194801947708,-2.3796131363424484,155
