node_id,eta,gamma,depth,alpha,layer,document_count,top_k,top_words,word_count,node_npmi,node_c_v,node_u_mass,iteration
23383,0.1,0.05,3,0.1,2,1,10,"crack, heat, thermal, phasefield, fracture, transient, inside, plate, open, inhomogeneous",10,0.05837247416832018,0.5244480312204216,-2.8683317059864724,115
23384,0.1,0.05,3,0.1,2,1,10,"interface, orthotropic, adhesive, effect, contact, body, tangential, bond, hyperelastic, complete",10,-0.0027622976360614677,0.42437608667905913,-2.6607956661246126,115
23385,0.1,0.05,3,0.1,2,1,10,"concurrent, composite, material, structural, scale, provide, performance, reduce, database, modeling",10,0.025944740805322188,0.5468820979745682,-2.1461821783598602,115
23386,0.1,0.05,3,0.1,2,1,10,"filler, composite, process, polymer, solver, fiber, understand, motion, simulate, particle",10,0.1080041434559948,0.44884343100548474,-2.2045962703544744,115
23387,0.1,0.05,3,0.1,2,1,10,"nitsches, weight, higherorder, form, prescribe, expression, bound, geometrical, choice, focus",10,-0.15801157393371237,0.25224486252653266,-2.5137097723584594,115
23388,0.1,0.05,3,0.1,2,1,10,"function, constraint, move, criterion, method, condition, explicit, topology, optimization, multiple",10,0.03133834341772748,0.23835772597850685,-2.379043419742443,115
23389,0.1,0.05,3,0.1,2,1,10,"boundary, treatment, shock, simulate, fractional, interior, correct, end, state, machine",10,-0.02655046805325326,0.3169527522737246,-2.927714818548617,115
23390,0.1,0.05,3,0.1,2,1,10,"rod, lattice, structure, investigate, homogenization, instability, special, deform, may, instance",10,0.057585799714653725,0.45440941615225167,-2.648325948323423,115
23391,0.1,0.05,3,0.1,2,1,10,"mesh, concentration, fluctuation, human, collocation, difference, grade, fractional, stage, meanwhile",10,-0.26448619044720684,0.5054196456417855,-2.743129868183197,115
23392,0.1,0.05,3,0.1,2,1,10,"geometrical, data, fcm, external, predict, effect, counterpart, imagebased, lattice, voxel",10,-0.1631621171971368,0.36625088555928476,-2.779715723553849,115
23393,0.1,0.05,3,0.1,2,1,10,"loss, function, pinn, neural, least, tailor, code, show, rapid, network",10,-0.12564909669464053,0.5121560329400339,-2.2054855343530777,115
23394,0.1,0.05,3,0.1,2,1,10,"dissipation, solver, mechanism, analyse, trace, integral, conclude, science, possible, mechanic",10,-0.2646401101719813,0.5611457589527198,-2.641998257812093,115
23395,0.1,0.05,3,0.1,2,1,10,"stress, residual, grain, plastic, laser, melt, additive, manufacturing, induce, temperature",10,0.17614031212223863,0.7012656920300694,-2.135283346993292,115
23396,0.1,0.05,3,0.1,2,1,10,"alloy, spatially, defect, increasingly, metallic, back, industry, pore, characterization, limit",10,-0.30948140454041234,0.7931620959435375,-2.255057537934671,115
23397,0.1,0.05,3,0.1,2,1,10,"tire, computation, st, highresolution, subdomain, car, aerodynamics, mdm, iga, mesh",10,0.10170864531311319,0.8335615289042254,-1.7448199177282917,115
23398,0.1,0.05,3,0.1,2,1,10,"design, phase, effective, stiffness, conductivity, bound, thermal, topology, weight, case",10,0.06640889663895302,0.3480862470188732,-2.5252278481057084,115
23399,0.1,0.05,3,0.1,2,1,10,"macroscale, mesoscale, calibration, anisotropic, practical, assessment, outofplane, previously, great, exist",10,-0.2765231120452999,0.6637418395488414,-2.595574335061434,115
23400,0.1,0.05,3,0.1,2,1,10,"relaxation, radius, trace, always, back, incorporate, tangent, constraint, equilibrium, path",10,-0.1419145429426609,0.5278010463424947,-2.174380774499624,115
23401,0.1,0.05,3,0.1,2,1,10,"pore, formation, rate, cast, additive, manufacturing, investigation, discuss, mechanism, effect",10,0.16333717299182382,0.5719502792310953,-2.0630486611423,115
23402,0.1,0.05,3,0.1,2,1,10,"overlap, high, along, subdomain, cost, edge, could, module, task, concentration",10,-0.06332683050621798,0.336270508289759,-2.8348261372703027,115
23403,0.1,0.05,3,0.1,2,1,10,"moment, mechanic, spherical, improvement, edge, position, separately, case, surface, without",10,-0.33665732458139247,0.3522362597081164,-2.131562569812226,115
23404,0.1,0.05,3,0.1,2,1,10,"concrete, composite, mechanical, property, network, equivalent, structural, heterogeneity, characteristic, wavelet",10,0.026860914370673023,0.7443779062103958,-2.7634208204420934,115
23405,0.1,0.05,3,0.1,2,1,10,"constitutive, tangent, manifold, available, continuum, law, end, often, equal, improve",10,-0.05281374602410216,0.3314033227675751,-2.725132109103675,115
23406,0.1,0.05,3,0.1,2,1,10,"set, data, space, stressstrain, point, behaviour, material, divide, elastoplasticity, treat",10,-0.0637157253365236,0.4176604121130582,-2.852044273589168,115
23407,0.1,0.05,3,0.1,2,1,10,"gradient, smooth, order, elasticity, meshfree, first, kernel, function, integration, second",10,0.09937630633935518,0.45725598745520485,-2.0615122454359676,115
23408,0.1,0.05,3,0.1,2,1,10,"pd, stabilize, severe, wave, instability, oscillation, force, damage, shock, peridynamics",10,-0.0905891625030924,0.5427799216940841,-2.555909256729263,115
